{
  "schema": "env_snapshot",
  "version": "1.2",
  "capture_phase": "pre_run",
  "run_environment_available": true,
  "runtime_at_run": {
    "availability": "captured",
    "harness_version": "see tools and provenance",
    "container_image": null
  },
  "captured_at": "2026-08-26T09:54:33.940142+00:00",
  "local_time": "2026-08-26T17:54:33+08:00",
  "host": {
    "hostname": "gpu704",
    "os": "Linux 6.8.0-136-generic",
    "machine": "x86_64",
    "python": "3.14.3",
    "cpus": 64,
    "memory_gb": 503.5,
    "loadavg_1_5_15": [
      "8.80",
      "8.20",
      "7.86"
    ],
    "in_docker": false,
    "docker": {
      "container_id": null
    }
  },
  "tools": {
    "codex": {
      "installed": true,
      "path": "/home/harry/.local/bin/codex",
      "version": "codex-cli 0.149.1"
    },
    "opencode": {
      "installed": true,
      "path": "/home/harry/.opencode/bin/opencode",
      "version": "1.18.18"
    },
    "opencodex": {
      "installed": true,
      "path": "/home/harry/.npm-global/bin/opencodex",
      "version": "opencodex 2.28.0"
    },
    "uv": {
      "installed": true,
      "path": "/home/harry/.local/bin/uv",
      "version": "uv 0.12.1 (x86_64-unknown-linux-gnu)"
    },
    "python3": {
      "installed": true,
      "path": "/home/linuxbrew/.linuxbrew/bin/python3",
      "version": "Python 3.14.3"
    },
    "git": {
      "installed": true,
      "path": "/usr/bin/git",
      "version": "git version 2.52.0"
    },
    "cmake": {
      "installed": true,
      "path": "/usr/bin/cmake",
      "version": "cmake version 3.28.3"
    },
    "mpirun": {
      "installed": true,
      "path": "/mnt/ssd-SATARAID5/harry/tools/openmpi-5.0.9/install/bin/mpirun",
      "version": "mpirun (Open MPI) 5.0.9"
    },
    "mpicc": {
      "installed": true,
      "path": "/mnt/ssd-SATARAID5/harry/tools/openmpi-5.0.9/install/bin/mpicc",
      "version": "gcc-13 (Ubuntu 13.3.0-6ubuntu2~24.04.1) 13.3.0"
    },
    "gcc": {
      "installed": true,
      "path": "/usr/bin/gcc",
      "version": "gcc (Ubuntu 13.3.0-6ubuntu2~24.04.1) 13.3.0"
    },
    "docker": {
      "installed": true,
      "path": "/usr/bin/docker",
      "version": "Docker version 29.5.3, build d1c06ef"
    },
    "codegraph": {
      "installed": true,
      "path": "/home/harry/.npm-global/bin/codegraph",
      "version": "1.5.0"
    }
  },
  "environment": {
    "count": 10,
    "vars": [
      {
        "name": "HTTP_PROXY",
        "set": true,
        "value": "http://192.168.31.65:20181/"
      },
      {
        "name": "HTTPS_PROXY",
        "set": true,
        "value": "http://192.168.31.65:20181/"
      },
      {
        "name": "ALL_PROXY",
        "set": true,
        "value": "socks5://192.168.31.65:20180/"
      },
      {
        "name": "http_proxy",
        "set": true,
        "value": "http://192.168.31.65:20181/"
      },
      {
        "name": "https_proxy",
        "set": true,
        "value": "http://192.168.31.65:20181/"
      },
      {
        "name": "SHELL",
        "set": true,
        "value": "/bin/zsh"
      },
      {
        "name": "USER",
        "set": true,
        "value": "harry"
      },
      {
        "name": "LOGNAME",
        "set": true,
        "value": "harry"
      },
      {
        "name": "HOME",
        "set": true,
        "value": "/home/harry"
      },
      {
        "name": "LANG",
        "set": true,
        "value": "C.UTF-8"
      }
    ]
  },
  "network": {
    "proxy_env": [
      {
        "url": "http://192.168.31.65:20181/",
        "reachable": true,
        "host": "192.168.31.65",
        "port": 20181,
        "env": "HTTP_PROXY"
      },
      {
        "url": "http://192.168.31.65:20181/",
        "reachable": true,
        "host": "192.168.31.65",
        "port": 20181,
        "env": "HTTPS_PROXY"
      },
      {
        "url": "socks5://192.168.31.65:20180/",
        "reachable": false,
        "error": "[Errno 111] Connection refused",
        "env": "ALL_PROXY"
      },
      {
        "url": "http://192.168.31.65:20181/",
        "reachable": true,
        "host": "192.168.31.65",
        "port": 20181,
        "env": "http_proxy"
      },
      {
        "url": "http://192.168.31.65:20181/",
        "reachable": true,
        "host": "192.168.31.65",
        "port": 20181,
        "env": "https_proxy"
      }
    ],
    "note": "only local TCP probes, no external requests"
  },
  "workspace": {
    "path": "/mnt/ssd-SATARAID5/harry/projects/cfd_agentic_benchmark/cfd_solver_benchmark_workspace_template/workspace/codex/generic/opus5-02",
    "branch": "codex/generic/init",
    "commit": "26ef1cb80b861688a4998d39431160a24ea1170a",
    "git_dirty": true,
    "dirty_files": 1,
    "agents_md_sha256": "7aa6dde4c59a33c3ac41b2182189cf0d7c30446ca4ec6a4421ffe245f8926725",
    "codegraph": true,
    "done_marker": false,
    "external_symlink": "/opt/external",
    "benchmark_submodule": {
      "exists": true,
      "commit": "1bc6580b84825037bbeac097ede1b2226d8185d1",
      "branch": "HEAD"
    },
    "state_timing": "initial_observed_pre_run"
  },
  "provenance": {
    "script": "/mnt/ssd-SATARAID5/harry/projects/cfd_agentic_benchmark/cfd_solver_benchmark_workspace_template/evaluation/tools/env_snapshot.py",
    "script_version": "1.2",
    "reconstruction_sources": [],
    "captured_workspace_state": null,
    "initial_branch_detection": {
      "canonical_branch": "codex/generic/init",
      "commit": "26ef1cb80b861688a4998d39431160a24ea1170a",
      "selected_ref": "refs/heads/codex/generic/init",
      "source": "local",
      "symbolic_head": "codex/generic/init",
      "candidate_refs": [
        {
          "ref": "refs/heads/codex/generic/init",
          "canonical_branch": "codex/generic/init",
          "source": "local"
        }
      ],
      "explicit_expected_branch": "codex/generic/init"
    },
    "limitations": []
  }
}
