{
  "schema": "env_snapshot",
  "version": "1.1",
  "capture_phase": "post_run",
  "run_environment_available": false,
  "runtime_at_run": {
    "availability": "unavailable",
    "harness_version": null,
    "container_image": null
  },
  "captured_at": "2026-08-14T16:12:23.266360+00:00",
  "local_time": "2026-08-15T00:12:23+08:00",
  "host": {
    "hostname": "gpu704",
    "os": "Linux 6.8.0-136-generic",
    "machine": "x86_64",
    "python": "3.14.3",
    "cpus": 64,
    "memory_gb": 503.5,
    "loadavg_1_5_15": [
      "9.74",
      "7.58",
      "6.26"
    ],
    "in_docker": false,
    "docker": {
      "container_id": null
    }
  },
  "tools": {
    "codex": {
      "installed": true,
      "path": "/home/harry/.local/bin/codex",
      "version": "codex-cli 0.147.0"
    },
    "opencode": {
      "installed": true,
      "path": "/home/harry/.opencode/bin/opencode",
      "version": "1.18.11"
    },
    "opencodex": {
      "installed": true,
      "path": "/home/harry/.npm-global/bin/opencodex",
      "version": "opencodex 2.14.0"
    },
    "uv": {
      "installed": true,
      "path": "/home/harry/.local/bin/uv",
      "version": "uv 0.12.1 (x86_64-unknown-linux-gnu)"
    },
    "python3": {
      "installed": true,
      "path": "/home/linuxbrew/.linuxbrew/bin/python3",
      "version": "Python 3.14.3"
    },
    "git": {
      "installed": true,
      "path": "/usr/bin/git",
      "version": "git version 2.52.0"
    },
    "cmake": {
      "installed": true,
      "path": "/usr/bin/cmake",
      "version": "cmake version 3.28.3"
    },
    "mpirun": {
      "installed": true,
      "path": "/mnt/ssd-SATARAID5/harry/tools/openmpi-5.0.9/install/bin/mpirun",
      "version": "mpirun (Open MPI) 5.0.9"
    },
    "mpicc": {
      "installed": true,
      "path": "/mnt/ssd-SATARAID5/harry/tools/openmpi-5.0.9/install/bin/mpicc",
      "version": "gcc-13 (Ubuntu 13.3.0-6ubuntu2~24.04.1) 13.3.0"
    },
    "gcc": {
      "installed": true,
      "path": "/usr/bin/gcc",
      "version": "gcc (Ubuntu 13.3.0-6ubuntu2~24.04.1) 13.3.0"
    },
    "docker": {
      "installed": true,
      "path": "/usr/bin/docker",
      "version": "Docker version 29.5.3, build d1c06ef"
    },
    "codegraph": {
      "installed": true,
      "path": "/home/harry/.local/bin/codegraph",
      "version": "1.2.0"
    }
  },
  "environment": {
    "count": 11,
    "vars": [
      {
        "name": "HTTP_PROXY",
        "set": true,
        "value": "http://192.168.31.65:20181/"
      },
      {
        "name": "HTTPS_PROXY",
        "set": true,
        "value": "http://192.168.31.65:20181/"
      },
      {
        "name": "ALL_PROXY",
        "set": true,
        "value": "socks5://192.168.31.65:20180/"
      },
      {
        "name": "http_proxy",
        "set": true,
        "value": "http://192.168.31.65:20181/"
      },
      {
        "name": "https_proxy",
        "set": true,
        "value": "http://192.168.31.65:20181/"
      },
      {
        "name": "SHELL",
        "set": true,
        "value": "/bin/zsh"
      },
      {
        "name": "USER",
        "set": true,
        "value": "harry"
      },
      {
        "name": "LOGNAME",
        "set": true,
        "value": "harry"
      },
      {
        "name": "HOME",
        "set": true,
        "value": "/home/harry"
      },
      {
        "name": "LANG",
        "set": true,
        "value": "en_US.UTF-8"
      },
      {
        "name": "LC_ALL",
        "set": true,
        "value": "C.UTF-8"
      }
    ]
  },
  "network": {
    "proxy_env": [],
    "note": "only local TCP probes, no external requests"
  },
  "workspace": {
    "path": "/mnt/ssd-SATARAID5/harry/projects/cfd_agentic_benchmark/cfd_solver_benchmark_workspace_template/workspace/codex/dsv4_flash/07",
    "branch": "codex/dsv4_flash/init",
    "commit": "ab943567cd55e707e760531ed7f2c914d09a0537",
    "git_dirty": true,
    "dirty_files": 2,
    "agents_md_sha256": "643dfc10388e08a8b3d83757b718b7da2b4812efae5a4006549f169f0a6d9dc4",
    "codegraph": true,
    "done_marker": true,
    "external_symlink": "../opencode_omoslim_deepseek/external",
    "benchmark_submodule": {
      "exists": true,
      "commit": "1bc6580b84825037bbeac097ede1b2226d8185d1",
      "branch": "HEAD"
    },
    "state_timing": "initial_reconstructed_post_run"
  },
  "provenance": {
    "script": "/mnt/ssd-SATARAID5/harry/projects/cfd_agentic_benchmark/cfd_solver_benchmark_workspace_template/evaluation/tools/env_snapshot.py",
    "script_version": "1.1",
    "reconstruction_sources": [
      "local init clone reflog plus workspace-local Codex primary root 019fcc37-26b8-7960-8a53-79430001b739 and bundled rollout records same branch and commit; result work branch was created from it",
      "git cat-file verified reconstructed commit object in this workspace"
    ],
    "captured_workspace_state": {
      "path": "/mnt/ssd-SATARAID5/harry/projects/cfd_agentic_benchmark/cfd_solver_benchmark_workspace_template/workspace/codex/dsv4_flash/07",
      "branch": "solver/attempt-1",
      "commit": "915af136f1468146e3b809c31986b3653f927223",
      "git_dirty": true,
      "dirty_files": 2,
      "agents_md_sha256": "643dfc10388e08a8b3d83757b718b7da2b4812efae5a4006549f169f0a6d9dc4",
      "codegraph": true,
      "done_marker": true,
      "external_symlink": "../opencode_omoslim_deepseek/external",
      "benchmark_submodule": {
        "exists": true,
        "commit": "1bc6580b84825037bbeac097ede1b2226d8185d1",
        "branch": "HEAD"
      }
    },
    "limitations": [
      "No pre-run environment snapshot exists for this legacy run.",
      "Host, tool, environment, and network values below describe post-run capture time, not the contestant execution environment.",
      "Original harness version and container image identity are unavailable."
    ]
  }
}
